{
  "$schema": "../schema/app.schema.json",
  "name": "Provenance",
  "bundleIdentifier": "org.provenance-emu.provenance",
  "developerName": "Provenance EMU",
  "subtitle": "Multi-system emulator",
  "localizedDescription": "Multi-emulator frontend for iOS and tvOS, supporting Atari, Bandai, NEC, Nintendo, Sega, SNK and Sony console systems.\n\nGet started: https://wiki.provenance-emu.com",
  "iconURL": "assets/apps/org.provenance-emu.provenance/icon.png",
  "tintColor": "#5856D6",
  "category": "games",
  "screenshots": [
    {
      "imageURL": "assets/apps/org.provenance-emu.provenance/iphone-1.jpg",
      "width": 593,
      "height": 1200
    },
    {
      "imageURL": "assets/apps/org.provenance-emu.provenance/iphone-2.jpg",
      "width": 655,
      "height": 1354
    },
    {
      "imageURL": "assets/apps/org.provenance-emu.provenance/iphone-3.jpg",
      "width": 579,
      "height": 1200
    },
    {
      "imageURL": "assets/apps/org.provenance-emu.provenance/iphone-4.jpg",
      "width": 655,
      "height": 1354
    },
    {
      "imageURL": "assets/apps/org.provenance-emu.provenance/iphone-5.jpg",
      "width": 593,
      "height": 1200
    }
  ],
  "versions": [
    {
      "version": "3.3.0",
      "buildVersion": "2852",
      "date": "2026-03-14T02:17:44Z",
      "localizedDescription": "## What's New in 3.3.0\n\nThis is a big one. Four months of work since 3.2.1 covering iCloud sync, a completely revamped tvOS interface, video filters, and a ton of core and stability fixes.\n\n### ☁️ iCloud / CloudKit Sync\n- ROMs, save states, BIOS files, and artwork now sync across devices via iCloud\n- Real-time download progress indicators when loading cloud save states\n- Auto BIOS sync on game load when available in iCloud\n- ROM metadata syncs alongside files\n- Artwork syncs after library updates\n- CloudKit records management tab in Settings\n- iCloud upsell UI for new users with empty libraries\n- Sync queue pauses during emulation and resumes after\n\n### 📺 New tvOS UI (Default)\n- Completely redesigned tvOS interface now enabled by default\n- RetroWave-themed side menu with smooth animations\n- Save states browser accessible from the main UI with artwork and core name\n- \"View All\" saves section with per-system filtering\n- TopShelf v2: recent games and save states with artwork and timestamps\n- Cheats UI in the pause menu\n- Game \"More Info\" panel\n- Log viewer tab\n- Import status view in side menu\n- Search with persistent history\n- Dozens of focus, navigation, and theming fixes throughout\n\n### 🎨 Video Filters & Shaders\n- Unified filter pipeline works across native and RetroArch cores\n- GB and VHS filters improved\n- Filters accessible from the pause menu\n- RetroArch GLES 3D cores now supported (Vecx/GLiden, etc.)\n- Dolphin shader/filter support\n- PPSSPP filter support\n\n### 🎮 Core & Controller Fixes\n- **RetroArch**: Fixed player index mapping for MFi, PS4, and Xbox controllers; PS4 start/select fixed; 32x controls added; GameCube controller responder added\n- **Mupen64Plus**: Fixed PS4 start button; fixed tvOS scaling and placement; better save error messages\n- **Dolphin**: Fixed Vulkan landscape rendering\n- **GenPluGX**: Added CHD support; added wide-screen GameGear core\n- **PicoDrive**: Fixed crash on unload; fixed 32x controller mapping\n- **FCEUmm**: Fixed start/select button mapping\n- **Mednafen**: Fixed DualShock/DualSense pause/play button mapping\n- **GameBatte / TGDB Dual**: Fixed PSX/Xbox pause/select button mapping\n\n### 🐛 Bug Fixes & Stability\n- Fixed multiple app hangs from main-thread Realm access (moved to background)\n- Fixed crash in pause menu when closing core\n- Fixed potential crash if audio ring buffer init fails\n- Fixed crash in share/import extension\n- Fixed aspect ratio issues in Stella and some other cores\n- Fixed FPS label appearing in screenshots\n- Fixed artwork not refreshing in game library after sync\n- Fixed game importer re-queuing already-imported items\n- Fixed Realm contentless core crash\n- Fixed \"Continue\" carousel metadata mismatch\n- Skin selector refreshes orientation previews on rotation change\n- ManicSkin/DeltaSkin files can now be opened directly from Safari\n- iPad import status modal clipped layout fixed\n- DSP audio engine fixes\n\n### ⚡ Performance\n- Artwork loading significantly faster\n- Game library UI rendering optimizations (removed unnecessary Observable wrappers)\n- Async tab bar icon loading\n- CloudKit sync deduplication and repeat-lookup fixes\n- Game importer skips MD5 hashing for large non-BIOS files\n\n**Full Changelog**: https://github.com/Provenance-Emu/Provenance/compare/3.2.1...3.3.0",
      "downloadURL": "https://github.com/Provenance-Emu/Provenance/releases/download/3.3.0/Provenance-3.3.0-iOS.ipa",
      "size": 1076407494,
      "sha256": "2aaf7fe05cbe86a5d8c5c012c4b87a688d68fd160f53cca1f486d2e7d0f70f8c",
      "minOSVersion": "16.0"
    }
  ],
  "appPermissions": {
    "entitlements": [
      "aps-environment",
      "com.apple.developer.associated-domains",
      "com.apple.developer.icloud-container-environment",
      "com.apple.developer.icloud-container-identifiers",
      "com.apple.developer.icloud-services",
      "com.apple.developer.sustained-execution",
      "com.apple.developer.ubiquity-container-identifiers",
      "com.apple.developer.ubiquity-kvstore-identifier",
      "com.apple.security.application-groups",
      "get-task-allow",
      "keychain-access-groups"
    ],
    "privacy": {
      "NSBluetoothAlwaysUsageDescription": "Provenance uses Bluetooth to support game controllers.",
      "NSCameraUsageDescription": "Used for album artwork.",
      "NSFileProviderDomainUsageDescription": "Provenance uses file provider for loading ROMs.",
      "NSLocalNetworkUsageDescription": "RetroArch needs access to Wi-Fi networks for enhanced emulated Wi-Fi network features.",
      "NSLocationUsageDescription": "Some games may use location data to enhance emulated location gameplay features",
      "NSLocationWhenInUseUsageDescription": "Some games may use location data to enhance emulated location gameplay features",
      "NSMicrophoneUsageDescription": "Provenance uses the microphone for systems that support audio input (eg. Famicom, Nintendo DS, 3DS).",
      "NSMotionUsageDescription": "Provenance uses your device's accelerometer and gyroscope to emulate the portable consoles' built-in accelerometer and gyroscope.",
      "NSPhotoLibraryAddUsageDescription": "Provenance can set custom artworks from your photos or save screenshots to the Photo Library.",
      "NSPhotoLibraryUsageDescription": "Provenance can set custom artworks from your photos or save screenshots to the Photo Library."
    }
  },
  "upstream": {
    "type": "github",
    "repo": "Provenance-Emu/Provenance",
    "asset": "*.ipa"
  }
}
